92.linkto_publication,https://www.ncbi.nlm.nih.gov/pubmed/?term=A+comparison+of+autism+prevalence+trends+in+Denmark+and+Wetern+Australia,https://www.ncbi.nlm.nih.gov/pubmed/?term=A+comparison+of+autism+prevalence+trends+in+Denmark+and+Western+Australia
7.title,A Prevalence investigation of Childhood Psychoses,Childhood psychosis in a northern Swedish county: Some preliminary findings from an epidemiological survey
2.title,Severe impairments of social interaction and associated abnormalities in children: Epidemiology and classification,Epidemiology of infantile Autism
92.author,"Parner,e t al.","Parner, et al."
128.cdc_calculated_values,prevalence estimate; CI; age xrange,prevalence estimate; CI; age range
129.study_years,211,2011
1.title,The prevalence of early childhood autism: comparison of administrative and epidemiological studies,Epidemiology of Autistic Conditions in Young Children
